{
  "$schema": "source-register.schema.json",
  "schema_version": "1.1.0",
  "library_version": "1.6.0",
  "checked_on": "2026-09-22",
  "maintainer": "ZEEP Research and Engineering",
  "authority": {
    "authoritative": true,
    "scope": "External evidence metadata, approved URLs, access tier and artifact checksum",
    "human_view": "SOURCE_REGISTER.md",
    "owner_role": "ZEEP Evidence Reviewer"
  },
  "runtime_policy": "Evidence files are review material only. Runtime thresholds and models must use separately versioned, tested policy/configuration.",
  "sources": [
    {
      "id": "HLT-005",
      "category": "health-wellness",
      "provenance": {"checked_on": "2026-09-22", "checked_by_role": "ZEEP Engineering evidence review (AI-assisted)", "method": "Read WHO BMI definition and adult classification; retain international thresholds as descriptive strata, not sleep-stage cutoffs"},
      "title": "Malnutrition in women — Nutrition Landscape Information System",
      "year": null,
      "identifiers": {},
      "source_url": "https://www.who.int/data/nutrition/nlis/info/malnutrition-in-women",
      "download_url": null,
      "local_file": null,
      "sha256": null,
      "access": "link-only",
      "license": "WHO website terms; link and paraphrase",
      "use_in_zeep": "BMI = kilograms / metres squared; adult international grouping at 18.5, 25 and 30. Used for demographic cohort labels only.",
      "limitations": "BMI is not a body-composition or Sleep Stage measurement. No automatic BMI correction to HR/RR, N3 or scores. No inference of Asian ethnicity; pregnancy and special populations require separate interpretation."
    },
    {
      "id": "HLT-006",
      "category": "health-wellness",
      "provenance": {"checked_on": "2026-09-22", "checked_by_role": "ZEEP Engineering evidence review (AI-assisted)", "method": "Read original npj Digital Medicine study and methods; distinguish remote on-demand HR from sleep-stage physiology"},
      "title": "Real-world heart rate norms in the Health eHeart study",
      "year": 2019,
      "identifiers": {"doi": "10.1038/s41746-019-0134-9"},
      "source_url": "https://www.nature.com/articles/s41746-019-0134-9",
      "download_url": null,
      "local_file": null,
      "sha256": null,
      "access": "full-text-online; cache-not-created",
      "license": "See publisher article rights statement",
      "use_in_zeep": "Supports examining age, reported gender and BMI as separate HR-related covariates rather than assuming one reference fits everyone.",
      "limitations": "Smartphone PPG/on-demand HR in a selected cohort, not N3/BCG validation. Does not justify ZEEP age-stage ranges, fixed female +2 bpm or any BMI-to-stage offset."
    },
    {
      "id": "SLP-012",
      "category": "sleep",
      "provenance": {"checked_on": "2026-09-22", "checked_by_role": "ZEEP Engineering evidence review (AI-assisted)", "method": "Read PMC full text, DOI/PMID and issue date; distinguish cardiac RR intervals from ECG-derived respiratory frequency"},
      "title": "Heart rate variability during daytime naps in healthy adults: Autonomic profile and short-term reliability",
      "year": 2016,
      "identifiers": {"doi": "10.1111/psyp.12595", "pmid": "26669510", "pmcid": "PMC4801685"},
      "source_url": "https://pmc.ncbi.nlm.nih.gov/articles/PMC4801685/",
      "download_url": null,
      "local_file": null,
      "sha256": null,
      "access": "full-text-online; cache-not-created",
      "license": "Author manuscript accessible on PMC; consult article rights before redistribution",
      "use_in_zeep": "N3 may occur during daytime naps; cardiac slowing and respiratory dynamics are supporting evidence, not interchangeable variables. Respiratory frequency did not differ significantly across stages in this study.",
      "limitations": "66 healthy young adults with 80-120 minute PSG naps; stage comparisons used a subset. Does not define universal N3 HR/RR ranges, validate ZEEP BCG or justify a 0.25 fit threshold."
    },
    {
      "id": "SLP-013",
      "category": "sleep",
      "provenance": {"checked_on": "2026-09-22", "checked_by_role": "ZEEP Engineering evidence review (AI-assisted)", "method": "Read NHLBI Sleep Phases and Stages of Sleep and displayed update date"},
      "title": "Sleep Phases and Stages of Sleep",
      "year": 2022,
      "identifiers": {},
      "source_url": "https://www.nhlbi.nih.gov/health/sleep/stages-of-sleep",
      "download_url": null,
      "local_file": null,
      "sha256": null,
      "access": "link-only",
      "license": "Public health education; see NIH site terms",
      "use_in_zeep": "Explain NREM/REM, brain-activity-based sleep stages and age-related changes in deep sleep.",
      "limitations": "Educational overview, not a numerical HR/RR baseline or validation of an EEG-free estimator."
    },
    {
      "id": "HLT-004",
      "category": "health-wellness",
      "provenance": {"checked_on": "2026-09-22", "checked_by_role": "ZEEP Engineering evidence review (AI-assisted)", "method": "Read MedlinePlus vital-sign ranges and adult-rest context; not used as stage classifier cutoffs"},
      "title": "Vital signs",
      "year": 2025,
      "identifiers": {},
      "source_url": "https://medlineplus.gov/ency/article/002341.htm",
      "download_url": null,
      "local_file": null,
      "sha256": null,
      "access": "link-only",
      "license": "A.D.A.M. medical encyclopedia; link and paraphrase only",
      "use_in_zeep": "General adult resting context: pulse 60-100/min and breathing 12-18/min; distinguish general resting reference from individual sleep patterns.",
      "limitations": "Not sleeping or N3 ranges. Varies with individual context; values outside these ranges alone do not establish disease or a Sleep State."
    },
    {
      "id": "SLP-001",
      "category": "sleep",
      "provenance": {"checked_on": "2026-09-05", "checked_by_role": "ZEEP Evidence Reviewer", "method": "PubMed/PMC identifiers, publisher metadata and cached artifact checksum"},
      "title": "Recommended Amount of Sleep for a Healthy Adult: A Joint Consensus Statement of the AASM and SRS",
      "year": 2015,
      "identifiers": {"doi": "10.5665/sleep.4716", "pmid": "26039963", "pmcid": "PMC4434546"},
      "source_url": "https://doi.org/10.5665/sleep.4716",
      "download_url": "https://europepmc.org/articles/PMC4434546?pdf=render",
      "local_file": "papers/sleep/aasm-adult-sleep-duration-consensus-2015.pdf",
      "sha256": "d01c3277f3ffbc6f5d69edf14dd4c42d5e3043abfd76115f8ee4eeace7e6d579",
      "access": "downloadable",
      "license": "open access; see article rights statement",
      "use_in_zeep": "Adult overnight duration reference: regular sleep of at least seven hours supports health.",
      "limitations": "Not a fixed target for naps, meditation, recovery modes or every individual."
    },
    {
      "id": "SLP-002",
      "category": "sleep",
      "provenance": {"checked_on": "2026-09-05", "checked_by_role": "ZEEP Evidence Reviewer", "method": "PubMed/PMC identifiers, publisher metadata and cached artifact checksum"},
      "title": "Sleep staging from electrocardiography and respiration with deep learning",
      "year": 2020,
      "identifiers": {"doi": "10.1093/sleep/zsz306", "pmid": "31863111", "pmcid": "PMC7355395"},
      "source_url": "https://doi.org/10.1093/sleep/zsz306",
      "download_url": "https://europepmc.org/articles/PMC7355395?pdf=render",
      "local_file": "papers/sleep/sleep-staging-ecg-respiration-deep-learning-2020.pdf",
      "sha256": "428137199a3d714c3884afb784ea0a514f6fc83fe54bbbcf1918a7756639050b",
      "access": "downloadable",
      "license": "open access; see article rights statement",
      "use_in_zeep": "Evidence that cardiac and respiratory dynamics plus temporal context contain sleep-stage information.",
      "limitations": "ECG and respiratory-effort model results are not direct validation of ZEEP BCG."
    },
    {
      "id": "SLP-003",
      "category": "sleep",
      "provenance": {"checked_on": "2026-09-05", "checked_by_role": "ZEEP Evidence Reviewer", "method": "PubMed/PMC identifiers, publisher metadata and cached artifact checksum"},
      "title": "Sleep Parameter Assessment Accuracy of a Consumer Home Sleep Monitoring Ballistocardiograph Beddit Sleep Tracker",
      "year": 2019,
      "identifiers": {"doi": "10.5664/jcsm.7682", "pmid": "30853052", "pmcid": "PMC6411173"},
      "source_url": "https://doi.org/10.5664/jcsm.7682",
      "download_url": "https://europepmc.org/articles/PMC6411173?pdf=render",
      "local_file": "papers/sleep/bcg-beddit-psg-validation-2019.pdf",
      "sha256": "f56242566db5cc4cc52bba8454fee82ac024315445e85b2748144d81f55d36f2",
      "access": "downloadable",
      "license": "open access; see article rights statement",
      "use_in_zeep": "BCG validation caution for TST, WASO and stage classification.",
      "limitations": "Different product and algorithm; small healthy-adult sample."
    },
    {
      "id": "SLP-004",
      "category": "sleep",
      "provenance": {"checked_on": "2026-09-05", "checked_by_role": "ZEEP Evidence Reviewer", "method": "PubMed/PMC identifiers, publisher metadata and cached artifact checksum"},
      "title": "A validation study of a ballistocardiograph sleep tracker against polysomnography",
      "year": 2022,
      "identifiers": {"doi": "10.5664/jcsm.9754", "pmid": "34705630", "pmcid": "PMC8974370"},
      "source_url": "https://doi.org/10.5664/jcsm.9754",
      "download_url": "https://europepmc.org/articles/PMC8974370?pdf=render",
      "local_file": "papers/sleep/bcg-emfit-psg-validation-2022.pdf",
      "sha256": "26f49be9ac2a25f8425941626cf60ecd6cf1b326fd66e159516eb698944fa379",
      "access": "downloadable",
      "license": "open access; see article rights statement",